{
  "version": "1.0.0",
  "schemaVersion": "4.0.0",
  "project": "LLMGateway",
  "status": "draft",
  "objective": {
    "statement": "A local-first tool that routes developer queries to the most capable available LLM based on task complexity, minimising latency and cost.",
    "for": "Developers running local and cloud LLM backends simultaneously.",
    "problem": "Developers must manually decide which LLM to use per task, switching tools and accepting unnecessary latency or cost for simple queries.",
    "confirmedAfterCompletion": false
  },
  "functionalRequirements": [
    {
      "id": "REQ-000-CreateAccount",
      "actor": "developer",
      "description": "Developer can submit a query and receive a response routed to an appropriate backend.",
      "notes": "Routing decision is invisible to the developer unless they opt into verbose mode.",
      "name": "Create Account"
    },
    {
      "id": "REQ-001-Login",
      "actor": "developer",
      "description": "Developer can configure which backends are available and their priority order.",
      "name": "Login"
    },
    {
      "id": "REQ-002-Logout",
      "actor": "developer",
      "description": "Developer can view a log of past queries, which backend handled each, and response latency.",
      "name": "Logout"
    },
    {
      "id": "REQ-003-ResetPassword",
      "actor": "developer",
      "description": "Developer can force a specific backend for a query by passing an explicit override flag.",
      "name": "Reset Password"
    },
    {
      "id": "REQ-004-UpdateProfile",
      "actor": "gateway",
      "description": "Gateway falls back to the next available backend if the preferred backend is unavailable.",
      "name": "Update Profile"
    },
    {
      "id": "REQ-005-ProfileManagement",
      "name": "Profile Management",
      "description": "The system shall allow users to manage their profile information including password, email, and display preferences.",
      "actor": "User",
      "scRefs": [
        "SC-001-LoginSuccess"
      ],
      "reqRefs": [
        "REQ-001-Login"
      ]
    }
  ],
  "nonFunctionalRequirements": [
    {
      "id": "NFR-000-ResponseTime",
      "category": "Performance",
      "scale": "Routing overhead in milliseconds added to a query round-trip",
      "meter": "Measured locally with a no-op backend at 50 sequential queries",
      "must": "< 50ms",
      "plan": "< 20ms",
      "wish": "< 5ms",
      "name": "Performance",
      "description": "Performance requirement: < 50ms"
    },
    {
      "id": "NFR-001-Availability",
      "category": "Reliability",
      "scale": "Percentage of queries that fail due to gateway error (not backend error)",
      "meter": "Error rate measured over 1000 consecutive queries in integration test",
      "must": "< 1%",
      "plan": "< 0.1%",
      "wish": "0%",
      "name": "Reliability",
      "description": "Reliability requirement: < 1%"
    },
    {
      "id": "NFR-002-Security",
      "category": "Portability",
      "scale": "Supported operating systems without code changes",
      "meter": "Manual smoke test on each platform after each release",
      "must": "Linux x86_64",
      "plan": "Linux x86_64 and macOS arm64",
      "wish": "TBD \u2014 Windows support under evaluation",
      "name": "Portability",
      "description": "Portability requirement: Linux x86_64"
    }
  ],
  "userStories": [
    {
      "id": "US-000-Login",
      "actor": "developer",
      "capability": "submit a query without specifying a backend",
      "outcome": "I can focus on my task instead of managing which model to use",
      "reqRefs": [
        "REQ-001-Login",
        "REQ-005-ProfileManagement"
      ],
      "description": "As a developer, I want to submit a query without specifying a backend so that I can focus on my task instead of managing which model to use",
      "name": "Login"
    },
    {
      "id": "US-001-Register",
      "actor": "developer",
      "capability": "configure backend priority from a config file",
      "outcome": "I can adjust routing behaviour without modifying code",
      "reqRefs": [
        "REQ-002-Logout"
      ],
      "description": "As a developer, I want to configure backend priority from a config file so that I can adjust routing behaviour without modifying code",
      "name": "Register"
    },
    {
      "id": "US-002-Search",
      "actor": "developer",
      "capability": "inspect which backend handled each of my past queries",
      "outcome": "I can understand routing decisions and tune my configuration",
      "reqRefs": [
        "REQ-003-ResetPassword"
      ],
      "description": "As a developer, I want to inspect which backend handled each of my past queries so that I can understand routing decisions and tune my configuration",
      "name": "Search"
    },
    {
      "id": "US-003-ViewProfile",
      "actor": "developer",
      "capability": "force a specific backend for a single query",
      "outcome": "I can test a backend directly without changing my configuration",
      "reqRefs": [
        "REQ-004-UpdateProfile"
      ],
      "description": "As a developer, I want to force a specific backend for a single query so that I can test a backend directly without changing my configuration",
      "name": "View Profile"
    }
  ],
  "successCriteria": [
    {
      "id": "SC-000-AccountCreated",
      "description": "A query submitted without a backend override is routed and returns a response with no manual backend selection required.",
      "refs": {
        "reqRefs": [
          "REQ-001-Login"
        ]
      },
      "verificationMethod": "Automated integration test with two configured backends.",
      "name": "Account Created"
    },
    {
      "id": "SC-001-LoginSuccess",
      "description": "When the preferred backend is down, the gateway routes to the next configured backend and the query succeeds.",
      "refs": {
        "reqRefs": [
          "REQ-005-ProfileManagement"
        ]
      },
      "verificationMethod": "Integration test with primary backend disabled.",
      "name": "Login Success"
    },
    {
      "id": "SC-002-LogoutComplete",
      "description": "Routing overhead does not exceed 50ms on the reference machine at 50 sequential queries.",
      "refs": {
        "nfrRefs": [
          "NFR-001-Availability"
        ]
      },
      "verificationMethod": "Latency benchmark with no-op backend.",
      "name": "Logout Complete"
    },
    {
      "id": "SC-003-PasswordReset",
      "description": "All REQ-001 through REQ-005 pass their acceptance tests.",
      "refs": {
        "reqRefs": [
          "REQ-001-Login",
          "REQ-002-Logout",
          "REQ-003-ResetPassword",
          "REQ-004-UpdateProfile",
          "REQ-005-ProfileManagement"
        ]
      },
      "verificationMethod": "Full acceptance test suite.",
      "name": "Password Reset"
    }
  ],
  "nonGoals": [
    {
      "id": "NG-000-MobileApp",
      "name": "Mobile App",
      "capability": "Multi-user access control",
      "description": "The system will not support multiple users or account management in this release.",
      "reason": "Deferred to a future version; single-developer use only for this release."
    },
    {
      "id": "NG-001-ThirdPartyIntegration",
      "name": "Third Party Integration",
      "capability": "Web-based management UI",
      "description": "No web interface will be provided; configuration is done via CLI and config files.",
      "reason": "Out of scope; CLI and config file are sufficient for the target user."
    },
    {
      "id": "NG-002-LegacyMigration",
      "name": "Legacy Migration",
      "capability": "Fine-tuning or training of models",
      "description": "The gateway will not modify or train models; it only routes to existing backends.",
      "reason": "Out of scope; gateway routes to existing backends, does not modify them."
    },
    {
      "id": "NG-003-FeatureX",
      "name": "Feature X",
      "capability": "Billing and cost tracking across cloud providers",
      "description": "Detailed cost tracking and billing integration is not included in this release.",
      "reason": "Deferred; cost visibility is a logging concern handled in a later version."
    }
  ]
}